{
  "$schema": "https://ontology-dashboard.local/schemas/generator-extraction-fragment-consumption.schema.json",
  "consumption_schema_version": "generator-extraction-fragment-consumption-v1",
  "batch_id": "a1b2c3d4e5f60718293a4b5c6d7e8f90123456789abcdef0123456789abcdef0",
  "fragment_manifest_sha256": "e3b0c44298fc1c149afbf4c8996fb92427ae41e4649b934ca495991b7852b855",
  "referenced_windows": [
    "window-20260828T130000Z-map-a1b2c3d4"
  ],
  "published_windows": [
    "window-20260828T130000Z-map-a1b2c3d4"
  ],
  "pending_windows": [],
  "status": "fully_consumed",
  "updated_at": "2026-08-28T14:00:05Z"
}
